{
  "schema_version": "1.0.0",
  "decision_id": "DEC-2026-0105",
  "change_record_id": "CHG-2026-0042",
  "analyst_id": "ANALYST-DEF-712",
  "analyst_station_id": "STATION-ALPHA-AIRGAP",
  "decision": "CONFIRMED",
  "tactical_priority": "CRITICAL",
  "notes": "Verified against Sentinel-2 multispectral baseline. Confirmed tactical ridgeline spur road construction.",
  "timestamp": "2026-02-25T11:30:00Z",
  "audit_crypto": {
    "block_index": 1,
    "previous_block_hash": "0000000000000000000000000000000000000000000000000000000000000000",
    "payload_hash": "a9994068312c3c91c1a1e27f96472161694bc57bed57947a527089955824b986",
    "chain_hash": "c2665d8a80e67d69658fcbcd55e4a7b020be1af7f7e10c324362d482a108832a",
    "analyst_public_key": "a1b2c3d4e5f60718293a4b5c6d7e8f90a1b2c3d4e5f60718293a4b5c6d7e8f90",
    "signature": "09b5c025f15bd136b430badfc62fbcaf1016df0d31182da2f893fe6a75bef40e09b5c025f15bd136b430badfc62fbcaf1016df0d31182da2f893fe6a75bef40e"
  }
}